tweet,user_name,country,user_location,languageauthor and teacher kenneth rogers shares harrowingly graphic details of the sexual abuse he endured at the hands ,Rae Tyree,NONE,NONE,ena woman has been sexually abused,RESPECT,NONE,NONE,enmfc you crack down on everything but won t respond to a rape threat wtf is wrong with you,Max,NONE,USA,eni m being bullied by marcos van dalen saynotobully,Andres Diaz,NONE,NONE,enabc2020 i 100 believe the father daughter she is so been an abused woman jury s only hear what courts allow ,yonna jordan,NONE,NONE,enstalked by demons protected by angels ,erikG,NONE,NONE,enyou can tell when a woman has been abused just saying,yonna jordan,NONE,NONE,enso in love please dawn tell me how calling teenagers who get bullied by other teena ,Kayden Nicole,NONE,NONE,endaddy i m also going to have to mute you after this i don t much care for the sexist remarks u , Smash it Sam ,NONE,USA,enevery white teen being bullied by brown people and blamed for everything by their teacher ,Alt Right Sparky,NONE,NONE,enyou ve abused and exploited the resources of my love and patience and your access to me is revoked unless you ve ea ,Indignant Whore ,NONE,NONE,enwill there be any outrage by fake liberals or for them killing hindu is a secular act amp not worth wasting time ,Manish Trivedi ,NONE,India,enthen what award is to be given to a lady who was raped amp stalked by congress mla in kerala recently ,Raghavendra Upadhya,NONE,India,enhow horrible times are when a woman says they have been abused and people ridiculed her and say hor ,Rutilio medina,NONE,USA,enabc2020 i believe the father daughter she has been an abused woman the jury s only hear what courts allow,who,NONE,NONE,enhe can expect to be harrassed and bullied by the lunatics of the camp of saints readin alt right for daring to sp ,Alicia Norman,NONE,USA,endefends lena dunham and taylor swift but doesn t acknowledge the abuse of her own black female lead i can t , Sheri ,NONE,NONE,endisgusting behaviour by the left once again this just blows my mind ,Manda,NONE,Canada,enno matter what the vulgar left gt gt like anti american lt lt will show their true face boycottequinox , ,NONE,NONE,enbut the left are such gental insert pronoun here ,Zachary Jensen,NONE,USA,eni have been bullied by words before ,Macchiat ,NONE,Malaysia ,enrape and impregnation the latest threat by classdojo they succeeded in the other threats do i have to die first ,Shabana Jameel MEd,NONE,USA,enjust be honest you got bullied around the ring by mcgregor it s nothing to be ashamed about you got beat by sam eggington, ,NONE,NONE,enbengaluru bengaluru cops rescue abducted woman with the help of an autodriver ,IBTimes India,NONE,India,entwenty years on ellen opens up about being bullied by hollywood ,QNews,NONE,Australia,eni do remember the bit with bobby flay getting bullied by his tv mates in full detail,domo,NONE,NONE,enwe ve all been bullied by the box they ship us in ,Niqui,NONE,USA,enhold on let me understand this this player abused at least two woman and was handed a six game ,Chris Hawks,NONE,USA,enso every abused woman without proof is just s liar tell that to the ones who end up dead because no ,Tiffany,NONE,USA,encan you imagine being bullied by someone into saying you love them wow glad i can t relate ,dash,NONE,NONE,enwhy didn t you tell the woman who had a tpo there were places like sister care for abused women abusers leave you no money they isolate,Michelle Walker Ingl,NONE,NONE,enhave you imagine svt actually stalked us esp during csd those who maybe stalked by them are so lucky ,aina exams ,NONE,NONE,endtammons playing the white woman breast is reaching he abused sexually assualted a woman he deserves a suspens , FultzToPhilly,NONE,NONE,engfriend yes i m an army and a buddy myself i support both groups the same way it s so sad ,Seokjean ,NONE,NONE,enwestern culture and our children are being destroyed by design it s a zionist plot why do you think the adl is ,SGTreport,NONE,NONE,enunwarranted harassment of by employees is par for the lefty course no safe spaces for trump s ,Ellen Streiff,NONE,USA,eni can t imagine how you feel i ve been bullied by one person and it was horrible never an entire group of idiots ,Harlow,NONE,NONE,enthe bullying card is being played too often by some waspi women there s one proven bully amp we know who she is ,WeAreThe48 ,NONE,UK,enwhat does this even mean transphobically abused what ,It s Jon,NONE,NONE,enthe bullying card is being played too often by some waspi women there s one proven bully amp we know where she w ,WeAreThe48 ,NONE,UK,eneven at san s route impey is still bullied this time both by victor and dela chan ahaha coderea , ,NONE,NONE,enstalked by village head s son class 12 girl stabbed to death in up via ,animesh kumar,NONE,India,enthey blocked the photo ,catherine annette,NONE,NONE,enin fact because i was a beginner there are about 2 users who stalked and followed me indefinitely that also been bl cked by myself ,Kazuhikoyuku,NONE,NONE,eni feel so sorry for the lost souls who have to ask these questions unless they re being stalked by tiffany ,Tim Kittel,NONE,NONE,enpaulie talked all that shit and then got humiliated and ran home after being bullied on his own block by a mma guy ,Flawda,NONE,USA,enwoman abused in front of cops prank via ,Wave Empire,NONE,NONE,enpaulie been trash since ab took his belt and his girl ,Jerry Jr ,NONE,NONE,eni was stalked by my colleague iwasstalkedbymycolleague liferelationships ,WomanS Tale,NONE,NONE,engirl stalked by voyeur cam in toilet ,Teresia Cregger,NONE,NONE,enwhen you forget to use a comma so a complaint turns into a rape threat ,Jimbus,NONE,UK,eni swear i ll rather br kicked out of school than give a fuck about some group s feelings i will not be bullied by social justice fascist ,Moff Weiskiller,NONE,NONE,enwhat is this true surely not you re scared of someone with a different opinion ,PG1701,NONE,UK ,enthe entire state of californication is libtarded steer clear ,dan kelley,United States,USA,engirl stfu let people live their own lives and travel home without being harrassed ,Andrew,NONE,Australia,enme when i come home after being bullied by my customers and my roommate starts arguing with me ,s,NONE,NONE,enthe woman was dragged out of an empty coach and taken to an empty shop ,Vidhya Krishnan,NONE,India,enkai said it bts never mocked latinx what r u smoking neither did they dodged pride flag exo sang bout rape amp kee ,anya LOVE YOURSELF,NONE,NONE,enit s 6 30am two local criminals have already come in drunk yelled at me multiple times and made sexist remarks amazing,Jenbee ,United Kingdom,UK,eni this this guy stalked my insta and liked a picture by mistake ,b,NONE,Canada,eni rather to be recognized as a bad person than bullied by a good person,Aliana,NONE,Malaysia ,enyour fav was cheated and kicked by every man she is alone defends her pedob ,HOLD UP ,NONE,NONE,enwe re out at 11pm and being stalked by the family cat why tonight, alli ,NONE,USA,enare you people insane what is the matter with your idiots in la you people on the left just can t resist ,TopazSkylark,United States,USA,enwhy is it that cactus juice is stalked by crazed fans from a watch factory ,Did You Know ,NONE,USA,enfemale student harassed threatened by college after insisting her boyfriend did not abuse her ,M nnlicher Mensch,NONE,Germany,enhave u ever been bullied by someone b4 and then thought of them and instantly wanted to throw up bc me my cousin,alexis ebalo,United States,USA,en